iter	date	hypothesis	component_changed	predicted_impact	judge_verdict	decision	lesson
032	2026-09-05	writer anatomy drop required IN THIS CHAPTER + spoken instruction lead-in	prompts/chapter-writer.md (anatomy items 2–5)	factory-speech 14/10 → fall both by ≥2	Panel 53+53 composer-2.5: belief 13/13 both, journey 13/13 both, voice 13/13 both, comparison 13/13 both, book-arc PASS both; blocking 0 both; words 51349+50428; factory-speech 22+13 (was 14+10); willpower-lexicon 38+33; comparison partial 4+6; journey re-argument 10+10	REVERT	factory-speech 14→22 / 10→13 — both rose. Length floor met. Blocking 0/0. Header grep 0/0 (mechanism, not KEEP). Replacement lead-in "So here is my Nth instruction:" scored factory-speech both. Writer restored to 031 KEEP. Do not replay. Consecutive no-KEEP: 1. No 033 until founder answers architecture gate.
033	2026-09-05	BASELINE (A1+K1 dual-subject sugar+smoking, no factory wording)	-	-	Panel 53+57 composer-2.5: belief 13/13 and 14/14, journey 13/13 and 14/14, voice 13/13 and 14/14, comparison 13/13 and 14/14, book-arc PASS both; blocking 0 both; words 53208+54277 (floor 48000); noted both-books: factory-speech 20+18, willpower-lexicon 40+31, journey re-argument 16+8; comparison missing 0+2, partial 2+9; sugar-only copied-mannerism 4 vs 1	BASELINE	First dual-subject floors. All-PASS / zero blocking. factory-speech 20/18 is next PRIMARY (>=8 both). willpower-lexicon 40/31 not PRIMARY. journey re-argument 16/8 secondary eligible. A1 mostly CAP on sugar. Do not replay 020-024/028/029/030/032.
